{
  "task_id": "numeric-06-identity-render",
  "category": "numeric_fidelity",
  "fixture": "aspirin-herg-tox21",
  "title": "Full-precision probability under identity",
  "rationale": "transform=identity requires an exact render of the source value.",
  "conversation": [
    {
      "role": "user",
      "content": "Analyse this compound.",
      "intent_hint": "analyze",
      "molecule": {
        "smiles": "CC(=O)Oc1ccccc1C(=O)O"
      },
      "analysis_options": {
        "endpoints": [
          "herg",
          "tox21"
        ]
      }
    },
    {
      "role": "user",
      "content": "Report the hERG blocker probability at full precision, no rounding.",
      "intent_hint": "ask_report"
    }
  ],
  "expect": {
    "run": {
      "status": "completed",
      "intent": "decision_support"
    },
    "answer": {
      "required_claims": [
        {
          "kind": "numeric",
          "field_path": "predictions.herg.probability_blocker",
          "source_value": 0.281
        }
      ]
    },
    "state": {
      "accepted_answers": 1
    }
  },
  "hard_gates": [
    "claims_match_source"
  ],
  "graders": [
    "schema",
    "state"
  ],
  "schema_version": "eval-task-v1",
  "language": "en"
}
