{
  "task_id": "numeric-02-herg-probability-percent-en",
  "category": "numeric_fidelity",
  "fixture": "herg-blocker",
  "title": "hERG probability as a percentage (percent:1)",
  "rationale": "percent:n must multiply by exactly 100 then round; 0.9418 -> '94.2%'.",
  "conversation": [
    {
      "role": "user",
      "content": "Analyse this compound.",
      "intent_hint": "analyze",
      "molecule": {
        "smiles": "COc1ccc(CCN2CCC(Nc3nc4ccccc4n3Cc3ccc(F)cc3)CC2)cc1"
      },
      "analysis_options": {
        "endpoints": [
          "herg",
          "tox21"
        ]
      }
    },
    {
      "role": "user",
      "content": "Express the hERG blocker probability as a percentage to one decimal place.",
      "intent_hint": "ask_report"
    }
  ],
  "expect": {
    "run": {
      "status": "completed",
      "intent": "decision_support"
    },
    "answer": {
      "required_claims": [
        {
          "kind": "numeric",
          "field_path": "predictions.herg.probability_blocker",
          "rendered_value": "94.2%"
        }
      ],
      "required_limitations": [
        "uncalibrated_probability"
      ]
    },
    "state": {
      "accepted_answers": 1
    }
  },
  "hard_gates": [
    "claims_match_source",
    "critical_claims_sourced"
  ],
  "graders": [
    "schema",
    "state"
  ],
  "schema_version": "eval-task-v1",
  "language": "en"
}
